{
  "version": 1,
  "label": "시연 예시(선별)",
  "notice": "시연 예시는 실제 테스트 결과 가운데 고른 것으로, 성능 주장에 쓰지 않습니다. 성능은 백테스트로만 보고합니다.",
  "domains": ["소재·화학·분자", "단백질·생물·신약", "물리·PDE·기후"],
  "fields": [
    {"id": "battery", "name": "배터리·전해질 소재", "domain": "소재·화학·분자", "keywords": ["battery", "electrolyte", "materials", "배터리", "전해", "소재", "재료"]},
    {"id": "crystal", "name": "결정 구조", "domain": "소재·화학·분자", "keywords": ["crystal", "materials", "결정", "소재"]},
    {"id": "molgen", "name": "분자 생성·반응", "domain": "소재·화학·분자", "keywords": ["molecule", "molecular", "generative", "chemistry", "분자", "화학"]},
    {"id": "binding", "name": "단백질-리간드 결합", "domain": "단백질·생물·신약", "keywords": ["ligand", "binding", "docking", "drug", "protein", "결합", "리간드", "신약", "단백질"]},
    {"id": "protein-design", "name": "단백질 설계", "domain": "단백질·생물·신약", "keywords": ["protein", "design", "단백질", "설계"]},
    {"id": "omics", "name": "단일세포·유전체", "domain": "단백질·생물·신약", "keywords": ["single-cell", "genomic", "omics", "유전체", "단일세포"]},
    {"id": "operator", "name": "PDE·신경 연산자", "domain": "물리·PDE·기후", "keywords": ["operator", "pde", "fluid", "navier", "연산자", "유체", "편미분"]},
    {"id": "pinn", "name": "PINN·물리 정보 학습", "domain": "물리·PDE·기후", "keywords": ["physics-informed", "pinn", "물리 정보", "물리정보"]},
    {"id": "weather", "name": "기상·기후 예측", "domain": "물리·PDE·기후", "keywords": ["weather", "climate", "atmospheric", "forecast", "기상", "기후", "대기"]},
    {"id": "geo", "name": "지구물리·지진", "domain": "물리·PDE·기후", "keywords": ["seismic", "geophys", "wavefield", "지진", "지구물리"]},
    {"id": "gate", "name": "관문 시연", "domain": "물리·PDE·기후", "keywords": []}
  ],
  "samples": [
    {
      "id": "example-battery",
      "kind": "plan",
      "status": "featured",
      "title": "전해액 이온전도도 예측 GNN 대리모델",
      "summary": "리튬이온 배터리 전해액의 이온전도도를 예측해 후보 조성을 선별하는 연구계획입니다.",
      "domain": "소재·화학·분자",
      "field": "battery",
      "language": "ko",
      "path": "src/neumann/api/templates/samples/electrolyte_gnn.md",
      "documents": {"pdf": "electrolyte_gnn.pdf", "docx": "electrolyte_gnn.docx", "hwpx": "electrolyte_gnn.hwpx"},
      "license": "우리 작성(Neumann 팀, E0b 데모 계획서)",
      "public_ok": true,
      "expect_gate": "ok",
      "plan_id": "3d35460def76efc4a786dce769e614f0d54d110ee2837da6b8fc1dbcf88ef33c",
      "source_test": {"name": "E5-L1e2e v1 라이브(gpt-6.1-sol, 8020)", "result_hint": "plan.result.json", "server_port": 8020, "status": "done"},
      "origin": {"work_id": null, "url": null, "arxiv": null, "decision": null, "note": "가상 연구실 계획서"},
      "intended_weaknesses": [
        {"risk_code": "R3", "text": "조성이 거의 같은 중복 항목을 제거하지 않고 무작위 80/10/10 분할 → 학습·시험 세트 사이 누출", "plan_lines": [16, 17], "keywords": ["누출", "분할", "중복", "leak", "split"]},
        {"risk_code": "R2", "text": "비교 기준선을 '기존 baseline 2종'이라고만 적고 무엇인지 밝히지 않음", "plan_lines": [11], "keywords": ["기준선", "baseline", "비교"]},
        {"risk_code": "R2", "text": "오차 막대·반복 실행·절제 실험 없음", "plan_lines": [22], "keywords": ["오차", "시드", "절제", "ablation", "error bar"]},
        {"risk_code": "R7", "text": "홀드아웃 R2·MAE만 보고, 학습 범위 밖 조성에 대한 일반화 검증 없음", "plan_lines": [21], "keywords": ["일반화", "범위 밖", "holdout", "generaliz"]},
        {"risk_code": "R5", "text": "산업 협약을 이유로 코드·데이터 비공개 → 재현 불가", "plan_lines": [23], "keywords": ["재현", "공개", "code", "release"]}
      ],
      "curation": {"score": null, "breakdown": {"cards": 5, "quotes_verified": 17, "quotes_total": 17, "linkage_rate": 1.0, "semantic_match": 5, "semantic_weak": 0, "semantic_mismatch": 0, "failed_stages": 0, "e2e_failures": 0}, "reason": "과거 라이브 파일 대조: 카드 인용 연결과 단계 성공. 과거 화면·체크리스트 오류와 의미 검증 약함은 SAMPLES 보고서에 기록. 전체 점수나 과학적 정확도 주장이 아님.", "checked_by_human": false, "result_file": ".claude/worktrees/s2-E5-L1e2e/docs/reports/E5-L1e2e_live/plan.result.json", "result_sha256": "a0514a844e79987fbe9682783b57b033242fe94abdffd508f3c36c11d619797f", "result_generated_at": "2026-09-30T12:58:17.924130Z", "generation": "라이브 gpt-6.1-sol", "scored_at": "2026-09-30T19:07:53.359010+00:00"}
    },
    {
      "id": "example-binding",
      "kind": "plan",
      "status": "featured",
      "title": "단백질-리간드 결합 친화도 예측 등변 GNN",
      "summary": "단백질과 리간드의 3차원 구조로 결합 친화도를 예측하는 연구계획입니다.",
      "domain": "단백질·생물·신약",
      "field": "binding",
      "language": "ko",
      "path": "src/neumann/api/templates/samples/protein_ligand_affinity.md",
      "documents": {"pdf": "protein_ligand_affinity.pdf", "docx": "protein_ligand_affinity.docx", "hwpx": "protein_ligand_affinity.hwpx"},
      "license": "우리 작성(Neumann 팀, E4-L1e 예시)",
      "public_ok": true,
      "expect_gate": "ok",
      "plan_id": "0d75d00c63abe7a120a3d1808745bac87948206361d11b417d8253a887df6451",
      "source_test": {"name": "E5-L1e2e v1 라이브(gpt-6.1-sol, 8020)", "result_hint": "protein_ligand_affinity.result.json", "server_port": 8020, "status": "done"},
      "origin": {"work_id": null, "url": null, "arxiv": null, "decision": null, "note": "가상 연구실 계획서"},
      "intended_weaknesses": [
        {"risk_code": "R3", "text": "PDBbind general set과 CASF core set 사이 겹치는 복합체·유사 서열 단백질을 제거하지 않음, 스캐폴드·패밀리 분할 없음 → 누출", "plan_lines": [16, 17], "keywords": ["누출", "분할", "겹치", "유사 서열", "leak", "split", "family"]},
        {"risk_code": "R4", "text": "결정 구조가 없는 ChEMBL 화합물 3만 건에 도킹 포즈를 입력, 도킹 점수를 결합 친화도 라벨로 사용 → 라벨 잡음·순환", "plan_lines": [18], "keywords": ["도킹", "라벨", "docking", "label", "포즈"]},
        {"risk_code": "R2", "text": "비교 기준선이 AutoDock Vina 1종뿐, 학습 기반 기준선 없음", "plan_lines": [11], "keywords": ["기준선", "baseline", "vina", "비교"]},
        {"risk_code": "R2", "text": "시드 1개, 오차 막대·절제 실험 없음", "plan_lines": [23], "keywords": ["시드", "오차", "절제", "seed", "ablation"]}
      ],
      "curation": {"score": null, "breakdown": {"cards": 7, "quotes_verified": 27, "quotes_total": 27, "linkage_rate": 1.0, "semantic_match": 5, "semantic_weak": 2, "semantic_mismatch": 0, "failed_stages": 0, "e2e_failures": 2}, "reason": "과거 라이브 파일 대조: 카드 인용 연결과 단계 성공. 과거 화면·체크리스트 오류와 의미 검증 약함은 SAMPLES 보고서에 기록. 전체 점수나 과학적 정확도 주장이 아님.", "checked_by_human": false, "result_file": ".claude/worktrees/s2-E5-L1e2e/docs/reports/E5-L1e2e_live/protein_ligand_affinity.result.json", "result_sha256": "dacdcdd750fe89c80287a03bef4478ced22f504844a39bea977a8468c4aea190", "result_generated_at": "2026-09-30T13:01:05.590076Z", "generation": "라이브 gpt-6.1-sol", "scored_at": "2026-09-30T19:07:53.361024+00:00"}
    },
    {
      "id": "example-operator",
      "kind": "plan",
      "status": "featured",
      "title": "신경 연산자 기반 대기 유체 대리모델",
      "summary": "신경 연산자로 대기 유체의 시간 전개를 학습해 기상장을 예측하는 연구계획입니다.",
      "domain": "물리·PDE·기후",
      "field": "operator",
      "language": "ko",
      "path": "src/neumann/api/templates/samples/neural_operator_weather.md",
      "documents": {"pdf": "neural_operator_weather.pdf", "docx": "neural_operator_weather.docx", "hwpx": "neural_operator_weather.hwpx"},
      "license": "우리 작성(Neumann 팀, E4-L1e 예시)",
      "public_ok": true,
      "expect_gate": "ok",
      "plan_id": "11a5f2e74984d5ccc4fdedba1347cb66436f4b0e372d912357f20c4547ec74a6",
      "source_test": {"name": "E5-L1e2e v1 라이브(gpt-6.1-sol, 8020)", "result_hint": "neural_operator_weather.result.json", "server_port": 8020, "status": "done"},
      "origin": {"work_id": null, "url": null, "arxiv": null, "decision": null, "note": "가상 연구실 계획서"},
      "intended_weaknesses": [
        {"risk_code": "R3", "text": "시간 스냅샷을 무작위로 80/10/10 분할 → 인접 시점이 학습·시험에 섞이는 시간 누출", "plan_lines": [17], "keywords": ["누출", "분할", "시점", "snapshot", "temporal", "leak"]},
        {"risk_code": "R8", "text": "격자점 MSE만 쓰고 질량·에너지 보존, 비발산 조건을 반영하지 않음", "plan_lines": [11], "keywords": ["보존", "물리", "conserv", "physical"]},
        {"risk_code": "R2", "text": "6시간 한 단계 예측 오차만 보고, 10일 롤아웃의 오차 누적·안정성 평가 없음", "plan_lines": [22], "keywords": ["롤아웃", "장기", "rollout", "누적", "안정"]},
        {"risk_code": "R7", "text": "같은 해상도·같은 기간 안에서만 평가 → 해상도·기간 밖 일반화 검증 없음", "plan_lines": [18], "keywords": ["일반화", "해상도", "resolution", "generaliz"]},
        {"risk_code": "R1", "text": "수천 배 빠르다고 주장하면서 수치 해법 대비 계산 시간을 재지 않음", "plan_lines": [24, 28], "keywords": ["계산 시간", "속도", "speed", "cost", "비용"]},
        {"risk_code": "R2", "text": "시드 1개, 오차 막대 없음", "plan_lines": [23], "keywords": ["시드", "오차", "seed", "error bar"]}
      ],
      "curation": {"score": null, "breakdown": {"cards": 7, "quotes_verified": 25, "quotes_total": 25, "linkage_rate": 1.0, "semantic_match": 7, "semantic_weak": 0, "semantic_mismatch": 0, "failed_stages": 0, "e2e_failures": 3}, "reason": "과거 라이브 파일 대조: 카드 인용 연결과 단계 성공. 과거 화면·체크리스트 오류와 의미 검증 약함은 SAMPLES 보고서에 기록. 전체 점수나 과학적 정확도 주장이 아님.", "checked_by_human": false, "result_file": ".claude/worktrees/s2-E5-L1e2e/docs/reports/E5-L1e2e_live/neural_operator_weather.result.json", "result_sha256": "20f8a9524a540731c8ff1bdd5823d8fd78c8fb12428b8451c46734f4427cd650", "result_generated_at": "2026-09-30T13:03:53.222119Z", "generation": "라이브 gpt-6.1-sol", "scored_at": "2026-09-30T19:07:53.362551+00:00"}
    },
    {
      "id": "reject-too-short",
      "kind": "reject",
      "status": "retired",
      "title": "300자 미만 초안 — 단백질 백본 확산 모델",
      "summary": "연구 주제는 범위 안이지만 126자뿐이라 입력 관문이 분석하지 않고 무엇을 더 적을지 안내한다(거절 시연).",
      "domain": "단백질·생물·신약",
      "field": "gate",
      "language": "ko",
      "path": "src/neumann/api/templates/samples/reject_too_short.md",
      "license": "우리 작성(Neumann 팀, E4-L1g)",
      "public_ok": true,
      "expect_gate": "reject",
      "plan_id": null,
      "source_test": {"name": "입력 관문 시연(E3-L1s 300자 규칙, LLM 호출 0)", "status": "done"},
      "origin": {"work_id": null, "url": null, "arxiv": null, "decision": null, "note": "관문 거절 시연용. 분석 결과가 없는 것이 정상"},
      "intended_weaknesses": [],
      "curation": {"score": null, "breakdown": {}, "reason": "거절 시연. 점수 대상 아님", "checked_by_human": true, "result_file": null, "result_sha256": null, "result_generated_at": null, "generation": null, "scored_at": null}
    },
    {
      "id": "reject-off-scope",
      "kind": "reject",
      "status": "retired",